genre,tags
Fiction,"Feminism, Satire, Building,  etc.), Bloggers, African American women, World War I, Children, Adventure stories, Space Horror, Neo-Western, Antarctica, Actors, teen, Detective and mystery fiction, Animals, Dictators, Carnival owners, Antislavery movements, Conspiracies, Bisexuals, Middle Earth (Imaginary place), Fiction / Fantasy / Historical, Apocalypse, French literature, Castles, Life on other planets,  Personal, Female friendship, Homecoming, Aircraft accident victims, Imaginary wars and battles, Indians of North America, Cocktail servers, Dictatorship,  Thomas (Fictitious character), social science, High Fantasy, Alanna (Fictitious character), Information society, Popular literature, Escort services, Blind, Psychology, Drama, Magical Realism, Amnesiacs, Battles, Fiction / Fantasy / Dark Fantasy, Alcoholism, College teachers, Young adult fantasy, Sports, Dystopias, Post Apocalyptic, Gay men, Horror fiction, Acquaintance rape, Climatic changes, Chief executive officers, Actresses,  Battle of, Dark, Ghana, Goddesses, cosy mystery, Adoption, India, American fiction, Mafia, Hell, Crime, psychological horror, Abused women, Mentally ill, Bookbinding, Ambassadors,  Hercule (Fictitious character), Fame, Renaissance, Literary Fiction, General, Intelligence service, Butlers, Government investigators, Success, Fugitives from justice, Australian fiction, Florence (Italy), American History, Arms race, Bloomington (Ind.), Vampires, Soviet Union, Hackers, Businesspeople, Aventure and aventuriers, Siblings,  Holden (Fictitious character), Baudelaire, Computer hackers, Biographical fiction, Prisoners, California, Grimdark, Mystery, Ringworld (Imaginary place), Tennis stories, Anxiety disorders, Fantasy games, Cozy mystery stories, Gay teenagers, American wit and humor, STEM, Daye, Fairy tales, Brothers, Cryptographers, Camps, Adult children of aging parents, low fantasy, Brooklyn (New York, Animal behavior, Literary Collections, Large type books, Business & Economics, Mississippi, Beauty, War, Characters and characteristics in literature, Journalists, Electronic books, Railroad construction workers, Babel, science fantasy, Alchemists, English language, Burma, Book Clubs, Chess, Custody of children, Brainwashing, picture book, Supernatural, Religion, Magic realism (Literature), romcom, Manga, Mysterys, Brigands and robbers, Books, Ability, Human-animal relationships,  Jane (Fictitious character), Attempted assassination, Holocaust, Gossip, Dystopian, Humor, Weird fiction, Body horror, Emperors, Virginia Woolf, Colombia, adult, zombies, Computers, Books About Books, Oceania, Biography, Gender identity, Language Arts & Disciplines, Country life, Brotherhoods, North Dakota, Caste, History, Christmas stories,  Latin American, Intelligence officers, Dublin (Ireland), Space, Discworld (Imaginary place), Whodunnit, Technology, Cullen, Cross, Disasters, Adolescent psychology, Literary, Folklore, Extraterrestrial beings, Music, Political corruption,  Australian, Robots, Clubs, Novelists, Caribbean, Magic, Canada, Dreams, Dune (Imaginary place), Action and adventure fiction, Travel, adult romances, Literature, Devil, Great Britain, Contemporary Romance, Space Opera, College stories, Alera (Imaginary place), Contests, Automobile racing drivers, Knowledge, autobiography, Justice, Arthurian romances, Business intelligence, Cyberpunk fiction, Merlin (Legendary character), Appalachian Region, Sweden, Gardeners, Millennialism, Covenant, Children of the rich, Southampton Insurrection, witches, Allegories, African American gay men, Sports Romance, Cyberculture, Corporations, Post World War, Labor camps, North Carolina, Reincarnation, Cattle drives, Alabama, Gay, Fiction / Romance / Contemporary, Civilization, Fathers and daughters, Automobile racing, Women's Fiction, Chicago (Ill.), Ballerinas, cosmic horror, Assassins, Hole, Cats,  Dutch, romcoms, Filozofi, southern gothic, Foster home care, Young Adult, Fairies, China, French fiction, Chinese American women, Refugees, Betrayal, France, African Americans, Fashion editors, Lesbians,  Princess (Fictitious character), Study Aids, Middle Ages, Poirot, Humanity,  Mental, Italy, Feminist fiction, Television plays, Nigerian fiction (English), Climate and civilization, Immortalism, Madison (Wis.), Androids,  Greek, Period romance, Apprentices, Imaginary places,  Jim (Fictitious character), Romantic Comedy, Tokyo (Japan), Supernatural Fiction, Clergy, Mystery fiction,  Earl of Essex, Cozy, Administration of estates, English literature, Aging, Medical, Computer technicians,  Edward (Fictitious character), Call, Epistolary, African American police, Cooking, Briseis (Legendary character), Blomkvist, Stalker, Industrial relations, Children of alchoholics, Germany, Steampunk, Death, Creative ability in science, Xanth (Imaginary place), Fiction in English, Dead, Politics, Geishas, Dresden, Mental illness, Medical examiners (Law), Holden, Circumstellar matter, Automobile travel, English drama, Self help, Russian Literature, American literature,  1863, Nature stories, Alienation (Social psychology), Memory, Chick Lit, LGBTQ, Horror, slasher, Metaphysics, Fantasy, Amusement parks, Figure skaters, Private schools, Sisters, Choice (Psychology), Nat Turner's Rebellion, Asian Americans, End of the world, Fiction / Women, Romantic Suspense, Defection, Fiction / Romance / Romantic Comedy, Clumsiness, French drama, Fantasty fiction, Clairvoyance, Technology & Engineering, literary criticism, Adult children of dysfunctional families, Magic Realism, Aliens, Art, Demonology, Abusive men, Contemporary Fiction, Child abuse, Australia, detective, Missing persons, Romantasy, multimedia, Barcelona (Spain), Vietnam War, Identity (Psychology).,  Resistance to, Discoveries in geography, Leia, Russian fiction, Cornwall (England : County) - Fiction, Interpersonal attraction, Apartment houses, Cannery Row (Monterey,  1939-1945, Interpersonal relations, Drugs, Breast, Crime Fiction, Young Sleuth, Christmas, Divorced people, Baseball stories, Graphic novels, Addicts, Conspiracy, Fantasy romance, Arranged marriage, Mystery Thriller,  Tower of, Government, Children's Literature, speculative fiction, Young Adult Romance, American writers,  Folk Tales, Americans, Artists' books, political science, Humanities, Grief, Carnivals, Friends, Urban Fantasy,  artistic, Butterflies, Erotic stories, psychological fiction, Monster Romance, Deforestation, Fantasy fiction, Biography & Autobiography, Brennan, Choice, Hallucinogenic drugs,  Ancient,  1485?-1540,  Mikael (Fictitious character), World War, Fiction / Fairy Tales, Blizzards, Computer games, Erotic drama, Romance, Dark Romance, Boarding school students, American Dream, Batman (Fictitious character), Russia, Native Americans, Dark Academia, English fiction, Murder, Caffery, Immigrants, Autobiographical fiction, College teachers -- Fiction, Fiction in English - Dominican writers,  Classified, Fathers and sons, Aristocracy (Social class), Paranormal Romance, Disability, Japan, AIDS (Disease), Large print books, Film, Christian Fiction, Earth (Planet), Women lawyers, Boarding schools, Dinosaurs,  1900-1945 - Texts, Florida, Comics, Accidents, Historical Fantasy, Shark attacks, Etiquette, Novel, Adventure and adventurers, Mexico, Native American Literature, Maine, Amerikaanse fiksie, Indian Territory, Compact discs, Book clubs (Discussion groups), Fables, Cyborgs, African American children, Deaf people, Artificial Intelligence,  Legends & Mythology, Hockey Romance, Foreign Language Study, Best friends, Philosophical,  Calif.), ChickLit, Contemporary, Artificial life, Celebrities, medieval, Archetype (Psychology), murder mystery, Anthology, Bereavement,  1831, Lisbon (Portugal), Highlands (Scotland), Boys, Fiction / Science Fiction / General, Local author, Juvenile Fiction, Detective and mystery stories, Epic Fantasy, Short stories, Christianity, Smiley,  Harry (Fictitious character), Mental health, Family, Manuscripts, Emotional problems, Fiction, Human-robot interaction, Haunted houses, Artists, Families, Chinese fiction, Fiction / Fantasy / General, sapphic, Best sellers, Immortality, Gems, Domestic fiction, Afghan War,  etc, Education, Novella, Colorado, Plays, Blue (Fictitious character : Stiefvater), Comedias cinematograficas, Cowboy Romance, Criminal investigation,  Robert (Fictitious character), General fiction, Domestic drama, Beaches, Authors, Friendship, Motion picture plays, Conformity, Autistic children, Alchemy, Enemies to lovers, Historical Romance, Spanish literature, Self-Help, Military Fiction, Food, Defense information, Race, Interplanetary voyages, Authoritarianism, Children of clergy, Africans, Business communication, Fiction / Fantasy / Epic, Computer programmers,  1945-, Barges, Love stories, Civilians in war, United States, Czech fiction, Fear, Bisexual women, Prisoners of war, Man-woman relationships,  American, Spirituality, African American teenage girls, Gothic Horror, German language, Elias (Fictitious character), Belgians, Comics & Graphic Novels, Bristol (England), Castaways, Caulfield, Parenting,  Jack (Fictitious character), Jalisco (Mexico), Spanish fiction, Space warfare, Business, Smutty, Motion picture authorship, Bully Romance, Kidnapping victims, Time Travel, Dating (Social customs), Bildungsromans, Businesswomen, City and town life, Adventure, Suspense fiction, Cold cases (Criminal investigation), greek mythology, Women's History, Survival, Kidnapping, London (England),  Theory of, Mars (Planet), African American men, erotica, Identity (Psychology), Blessing and cursing,  October (Fictitious character), Governors, Poetry, Extortion, Psychological thriller, Mythology, Businessmen, Bennet,  Jewish (1939-1945), Children's stories, Existentialism, Fiction / Mystery & Detective / General, Conduct of life, True crime, Antiquities, Books and reading, Retellings, Concentration camps, Anonymous persons,  Alex (Fictitious character), Black Love, Taboo Romance, DC Comics, Data encryption (Computer science), Homeless children,  Thomas, Genetic engineering, Cities and towns, Heroes, Birthfathers, Humorists, New adult, Human-alien encounters, Romantic fantasy, Nihilism, British, Mafia Romance, Chemical warfare, Family & Relationships, Mysticism, Cults, Nigeria, Classical fiction, Dogs, Retelling, Dwarfs, Gulls, Accident victims, Historians, Historical Mystery, Mathematics, comedy, Memoir, Human behavior, Death (Personification), Dark Comedy,  Klaus (Fictitious character), X-ology, Deception, Thriller, Black Dagger Brotherhood (Fictitious characters), LGBTQ Literature, Bail bond agents,  N.Y.), Performing Arts, Middle Grade, Erotic romance, Civil war, College students, Beat generation,  2001-, Womanhood, Post-Apocalyptic Science Fiction, Chinese American teenagers, Widows, Relationships, Overpopulation, Arctic regions,  Dirk (Fictitious character), Glasgow (Scotland), Manors, Young Adult Fiction, Gothic, cyberpunk, England, Didactic fiction, Ambition, Realistic Fiction, Creation (Literary, Colombo (Sri Lanka), Appalachian Trail, Coma, American poetry, Police, Humorous stories, Forensic Science, Models (Persons), Clairvoyants,  Korean, American drama, Abuse of administrative power, Afghanistan, American, Family secrets, Abduction, Western, Japanese fiction, Authors in literature, Communists, Electronic mail messages, Early memories, Children's poetry, Indonesian language, Castle Rock (Me. : Imaginary place), Fantastic fiction,  Elizabeth (Fictitious character), Period piece, Canadian fiction, Charms, Women, Monsters, Classics, Biographers,  English, Haunted House, Nonfiction, Cowboys, Black Death,  Woodrow (Fictitious character), communism, Amsterdam (Netherlands), Cousins, Read 2024, Asian American women, Science fiction, Cannibalism, Bioengineering, Adoptees, Toronto, Spanish, Queer, African American girls, Romance fiction, Gothic novels, Chinese Americans, High school, dragons, Guerrilla warfare, African American families, Broadsides, Belief and doubt, Africa, Science, Adultery, Nature, Philosophy, Algeria, Amnesia, Downloadable e-Books, Korea (North), Abandoned children, Coming of Age,  George (Fictitious character), Alternative histories (Fiction), gods, Humorous fiction, multiverse, German fiction, Husbands, Epidemics, Anansi (Legendary character), Cloning, Forensic scientists, Alzheimer's disease,  1961-1975, Japanese literature, Couples, Juvenile Nonfiction, Boston (Mass.), reference, Historical Fiction, Adolescence, Cromwell, Crime investigation, Homelessness, Good and evil, Suspense, Manhattan (New York, Fourth dimension, Comic fantasy, Adult Fiction, Angels, Apartment concierges, cozy mystery,  Subterranean,  Canadian, Fathers, Adopted children, All Souls' Day, Anarchism, Depression, Fate and fatalism, Space colonies, Occult, Asia, Documentary films, Alcoholics, Military, Bipolar disorder in adolescence, French language, Alienation (Philosophy)"
Unknown,nan
Young Adult,"Magic, Children, Adventure stories, Literature, Contemporary Romance, Romance, Deportation, Contests, Native Americans, autobiography, Murder, Caregivers, Mathematics, Memoir, African American women lawyers, Boarding schools, Thriller, Young Adult Fiction / Mysteries & Detective Stories, Comics, College students, Psychology,  2001-, Book clubs (Discussion groups), Magical Realism, Young adult fantasy, Young Adult Fiction, Young Adult, Fairies, Young Adult Fiction / Romance / Contemporary, Realistic Fiction, Asexuality, Contemporary, African Americans, Lesbians, Television plays, Food habits, Boys, Juvenile Fiction, Apprentices, Detective and mystery stories, Crime, Paranormal, Mental health, Family, General, Children of Holocaust survivors, African American mathematicians, Fiction, Fugitives from justice, Afghan War, Education, Politics, Siblings, Authors, Mental illness, Friendship, Mystery, Women, Health & Fitness, Self-Help, Classics, Bullies, High school students, LGBTQ, Nonfiction, Horror, Fantasy, Science fiction, Young Adult Nonfiction, Spanish, Queer,  American, High school, Comics & Graphic Novels, War, literary criticism, Aliens, Science, Attempted murder, Philosophy, Amnesia, Romantasy, Coming of Age, Religion, Ability, Abused teenagers, Adventure, Suspense fiction, Dystopian, Humor, Juvenile Nonfiction, Graphic novels, Historical Fiction, Biography, Young Adult Romance, History, Suspense, Application software, Poetry, Blogs, Space, Acculturation, Urban Fantasy, Evolution (Biology), Biography & Autobiography"
Horror,"Supernatural, southern gothic, Young Adult, Horror fiction, Dystopian, Humor, Friendship, literary horror, Mystery, adult, Murder, Horror, Police, Fantasy, Good and evil, Science fiction, Crime, Paranormal, Thriller, Literary Fiction, Family secrets, Fiction"
History,"Travel, Anthropology, Computer games, Literature, Romance, Finance, Fermat's last theorem, Antarctica, Crime investigations, Native Americans, Murder, Immigrants, America, Mathematics, US History, Memoir, Diophantine analysis, Rome, Thriller, Debt, Comics, Islam and politics, social science, Civilization, Psychology, Chicago (Ill.), Biology, Sports, Young Adult, China, Shipwreck survival, African Americans, Law, India,  China),  Viking, Racism, Family, General, Chronology, Medical, Nanjing (Jiangsu Sheng, Intelligence service, Cooking, Environmental degradation, Eugenics, Politics, Friendship, Mystery, Health & Fitness, Women, Classics, Ethnic relations, LGBTQ, Nonfiction, Cancer, United States, Developing countries, Capitalism, Historical, Ireland, Imperial Trans-Antarctic Expedition, Antineoplastic agents, Business & Economics, Comics & Graphic Novels, War, Science, Nature, Philosophy, Business, Nan-ching shih (China), Salt, Religion, Veganism, Adventure, Humor, Games, Religion & Spirituality, Books About Books, Biography, History, political science, Architects, Egypt, Space, Technology, True crime, Biography & Autobiography, Music"
Fantasy,"Magic, Polish language materials, Canada, Feminism, Assasins, Fiction / Fantasy / Action & Adventure, African American women, Travel, Children, Omegaverse, Mythological, New adult, Adventure stories, Bodyguards, Literature, Barbarians, Contemporary Romance, Space Opera, Romance, Dark Romance, Buddhist gods, Boarding school students, Contests, Bards and bardism, informative, Dark Academia, English fiction, Murder, Retelling, Animals, Arts, Air warfare, Paranormal Romance, Fathers and sons, Conspiracies, Forests and forestry, Humorous fantasy, Holiday, apologetics, Death (Personification), science fiction fantasy, Detectives, Action, Thriller, Carnivorous plants, Boarding schools, cozy fantasy, Comics, Historical Fantasy, Imaginary wars and battles, Middle Grade, Slice of life, litrpg, False personation, High Fantasy, Psychology, Drama, Post-Apocalyptic Science Fiction, Magical Realism, Odysseus (Greek mythology), Curiosities and wonders, Chicago (Ill.), cosmic horror, Assassins, Bands (Music), Coffee shops, Academic writing, adventurous, Young adult fantasy, Young Adult Fiction, Dystopias, Young Adult, Gothic, Gay men, China, Housekeepers, Foreign Language Study, Realistic Fiction, Mystical powers, Betrayal, African Americans, Contemporary, Lesbians, murder mystery, Police, Balls (Parties), Boys, fantas, American fiction, Juvenile Fiction, Apprentices, Imaginary places, Antiheroes, Detective and mystery stories, Romantic Comedy, Epic Fantasy, psychological horror, Supernatural Fiction, Short stories, fae, Cozy, Paranormal, New adult fantasy,  Lyra (Fictitious character),  Harry (Fictitious character), Community life,  Mythical, Family, Literary Fiction, Bishop, General, Xianxia, Magical School, Fiction, Sword and Sorcery, Vietnam, pulp fiction, Families, Fairy Tale Retelling,  Diana (Fictitious character), Australian fiction, Paranormal romance, Corruption, Fanfiction, College graduates,  etc, Novella, Education, Internet, Fantastic fiction, Vampires, Steampunk, Death, Plays, Canadian fiction, Politics, Clans, Abused wives, Criminal investigation, Siblings, Dresden, short story, Friendship, Enemies to lovers, Biographical fiction, Grimdark, Alchemy, Mystery, Women, California, Catskill Mountains (N.Y.), Classics, Historical Romance, Chick Lit, LGBTQ, Nonfiction, Horror, science-fiction, Gods and goddesses, Fiction / Fantasy / Epic, Read 2024, Fantasy, Science fiction, Belacqua, Spanish, End of the world, Romantic Suspense, Queer, Fairy tales,  American, Brothers, Camps, Gothic novels, Gothic Horror, low fantasy, Read 2023, dragons, Literary Collections, Comics & Graphic Novels, War, Characters and characteristics in literature, literary criticism, Magic Realism, Fiction / Fantasy / Military, Electronic books, Aliens, Art, Demonology, quest, Science, Teenagers, science fantasy, indigenous, Philosophy, Romantasy, Smutty, Dark Fantasy, Fantasy., Fantasy comic books, Time Travel, Dungeons and Dragons (Game), Supernatural, Religion, Manga, Forgers, Earthquake zones, Asian Literature, Ability, Attempted assassination, Demoniac possession, Screenplay, Queer Manga, Interpersonal relations, Adventure, Dystopian, greek mythology, Games, Humor, Japanese literature, Juvenile Nonfiction, Religion & Spirituality, Graphic novels, Progression Fantasy, Fantasy romance, adult,  Human, Historical Fiction, Biography, Children's Literature, speculative fiction, erotica, Young Adult Romance, History, Good and evil, Blessing and cursing, Suspense, Hobbits (Fictitious characters), Alaska, Absentee fathers, Adult Fiction, Angels, Poetry, Businessmen, Mythology, Psychological thriller, Alliances, cozy mystery, Abnormalities, Space, Discworld (Imaginary place), Urban Fantasy, Children's stories, Tragedy, Erotic stories, Anxiety in adolescence, Buddhist nuns, Asia, Books and reading, Retellings, Fantasy fiction, Folklore, Science fiction romance"
Nonfiction,"Feminism, Bureaucracy, African American women, Travel, Sociology, Introversion, Literature, Romance, Behavior, Finance, Crime investigations, Family & Relationships, Actors, autobiography, informative, Murder, Immigrants, Arts, Mathematics, comedy, Memoir, Algorithms, Fraud, Consumers' preferences, Geography, Leadership, Advice, Decision making, social science, God, Psychology, Personal Development, Academic writing, Biology, Sports, Essay, House & Home, White people, Body, Spiritualism, Ethics, Sex instruction for women, African Americans, Celebrities, Games & Activities, tech development, Adulthood, Cookbook, Law, Racism, Crime, Inspirational,  Mind & Spirit, Assertiveness (Psychology), Mental health, Family, General, Medical, Cooking, American History, Economics, Activism, Education, Reclame, Autistic Spectrum Disorder, Politics, Chance, Friendship, Self help, Women, Health & Fitness, Self-Help, Food, Race, Nonfiction, Anxiety disorders, Information technology, Spirituality, Computer software, Marathon running, Literary Collections, Critical thinking, Business & Economics, War, Technology & Engineering, literary criticism, Belief and doubt, non-fiction, Art, Parenting, Cognition, Science, Nature, Philosophy, Business, Basic income, Neuroscience, Religion, Social Issues, Attention, Writing, Essays, Humor, Productivity, Games, Programming, Computer Science, Linguistics, Rationalism, Computers, reference, Innovation, Biography, Language Arts & Disciplines, Design, History, political science, Health, Space, Errors, Technology, True crime, Conduct of life, Disasters, Emotions, Authorship, Consumption (Economics), Biography & Autobiography, Pedagogy, Ghosts & Hauntings, Anecdotes, Feminist Theory"
Science fiction,"Magic, Artificial Intelligence, Young Adult Fiction, lgbtqia+, Post Apocalyptic, Young Adult, Dune (Imaginary place), Adventure, Human-alien encounters, Dystopian, Drugs, Humor, Literature, furry, Friendship, Contemporary, Space Opera, Romance, Astronauts, Mystery, Classics, alternate history, adult, LGBTQ, Nonfiction, Interplanetary voyages, Biography, Horror, speculative fiction, Detective and mystery fiction, Scotland, Read 2024, Fantasy, History, Noir, Solarpunk, Mathematics, Science fiction, Suspense, Juvenile Fiction,  Jim (Fictitious character), science fiction fantasy, Short stories,  American, Thriller, Paranormal, Space, Comics, American, Family, Literary Fiction, War, General, social science, Fiction, Aliens, Science, science fantasy, Amnesia, Curiosities and wonders, Robots, Time Travel"
Religion & Philosophy,"ideology, Education, Religion, Appointment books, Habit, Politics, Body, Ethics, Language and languages, Self-Help, Entitlement attitudes, Nonfiction, Language Arts & Disciplines, Change (Psychology), Philosophers, political science,  Mind & Spirit, Business & Economics, General, social science, Philosophy, Psychology"
Humor,"Games & Activities, Humor, Mathematics, Crafts & Hobbies"
Classics,"Feminism,  etc.), Artificial intelligence., Travel, Children, Minimum wage, Investments, Literature, Irish Americans, Romance, Evolution, Finance, Animal rights, Indonesia, Family & Relationships, Women's rights, Murder, Mothers, Mathematics, Memoir, City planners, Denken, Dark Comedy, Thriller, Leadership, Speeches, social science, Self-actualization (Psychology), Psychology, Drama, Presidents, Artificial Intelligence, Young Adult, Gothic, Body, Foreign Language Study, Realistic Fiction, Creation (Literary, African Americans, Celebrities, Juvenile Fiction,  Mind & Spirit, psychological horror, Art and music, Mental health, Family, General, Fiction, Medical, Education, Economics, Plays, Politics, Siblings, Authors, Mental illness, Friendship, Self help, Energy policy, Mystery, Women, Classics, Self-Help, LGBTQ, Nonfiction, Horror, Business ethics, Fantasy, Science fiction, Spanish,  American, Brothers, Large type books, Literary Collections, Business & Economics, Control (Psychology), War, literary criticism, non-fiction,  Chinese, Electronic books, Art, Stoicism, Science, English language, Nature, Philosophy, Business, Religion, Essays, Interpersonal relations, Adventure, Dystopian, Humor, Computer Science, Juvenile Nonfiction, reference, Computers, Historical Fiction, Biography, Language Arts & Disciplines, History, Poetry, Feminist ethics, Psychological thriller, Neurology, Space,  artistic, True crime, Conduct of life, Investing, Epic Poetry, Books and reading, Biography & Autobiography, Regency Romance, Blue collar workers"
Biography,"Autoimmune diseases, Religion, Businesspeople, Travel, Botany, Autistic Spectrum Disorder, Politics, Adventure, Authors, Humor, Japanese literature, African Americans, Self help, Motion picture actors and actresses, Women, Family & Relationships, Self-Help, Undertakers and undertaking, Psychotherapists, Native Americans, autobiography, Biography, Nonfiction, Heist, African American men, Disability, American wit and humor, African American authors, History, comedy, political science, Memoir, Grief,  American, Space, Anti-racism, Business & Economics, Family, Mental health, Technology & Engineering, General, Technology, social science, Science, Biography Memoir, Nature, Philosophy, Psychology, Biography & Autobiography, Falconry, Business, Cooking"
Children's Fiction,"Juvenile Fiction, Children's stories,  Swiss (German), Adventure stories"
Action & Adventure,"Feminism, Education, Sports, Young Adult, Travel, Amazon River Region, Surfers, Adventure, Adventure stories, Dystopian, Sports & Recreation, Humor, Realistic Fiction, Bourne, Mystery, Women, Antarctica, Classics, autobiography, LGBTQ, Nonfiction, Biography, Autobiographical fiction, Fantasy, History, India, Science fiction, Suspense, Memoir, Juvenile Fiction, Large print books, Mountaineering expeditions, Thriller, Space, Puzzles, Comics, War, General, social science, Fiction, Aliens, Spy, Science,  Jason (Fictitious character), Seas, Philosophy, Australia, Agriculture, Biography & Autobiography, Espionage, Bookstores, Arches National Park (Utah), Assassins"
