genre,tags
Comics,"Romance, Manga, Graphic novels, Science, House cleaning, House & Home, Philosophy, Biography, Biography & Autobiography, Nonfiction, Home economics, Self help, Comics, Humor, Comics & Graphic Novels, Memoir"
Business & Economics,"Computer Science, Economics, Finance, social science, Male domination, Spanish, Sports, Industrial productivity,  Personal, Psychology, Nonfiction, Business, Self-management (Psychology), Entrepreneurship, Business & Economics, Productivity, Technology, Self help"
Science,"Artificial Intelligence, Data Visualization, Dreams, Mental discipline, Health & Fitness, Memory, Women, Computers, tech development, Nonfiction, Big data, Mathematics, Materials science, Data, Animal communication, Space, Astrophysics, Astronomy, Business & Economics, Technology, social science, Art, Science, Nature, Psychology"
War,"War, social science, autobiography, Philosophy, Travel, Historical Fiction, Nonfiction, Biography, Biography & Autobiography, Korea (North), Self help, Computers, Dystopian, WW2, Fathers and sons, Family, political science, Memoir"
Psychology,"Women, Health & Fitness, Family & Relationships, Self-Help,  Mind & Spirit, Computers, Adaptability (Psychology), Psychology, Philosophy, Guilt, Body, Productivity, General"
LGBTQ,"Novelists, Magic, Essays, Authors, Realistic Fiction, African Americans in mass media, Romance, Women,  English, LGBTQ, Biography, Nonfiction, Historical Fiction, Memoir, Poetry, Spanish, Short stories, Queer,  American, Comics, Business & Economics, Family, War, General, social science, Fiction, Amherst (Mass.), Philosophy, Biography & Autobiography, M M Romance"
Dystopian,"Canada, Novella, Post Apocalyptic, Young Adult, LGBTQ, Biography & Autobiography, Fantasy, Dystopian, Science fiction"
Romance,"College Romance, Young Adult, Erotica, Realistic Fiction, Contemporary Romance, Contemporary, Christmas, Romance, Flight attendants, Dark Romance, Autism, Dark, Chick Lit, Mafia Romance, Cults, adult, College, Fantasy, Paranormal Romance, Mafia, Asian Americans, Brothers, Thriller, Spicy, BDSM, Sports Romance, Fiction, Retellings, Magical Realism, Abuse"
Biography & Autobiography,"Gilmore Girls (Television program), Women, Journal, Memoir, LGBTQ, Biography & Autobiography, Politics, Nonfiction, Space, Presidents, Humor, High technology industries, General"
Mystery,"Novella, Vampires, Abused, Gothic, Domestic drama, Mystery, adult, Historical Fiction, cosy mystery, Horror, women, Suspense, Psychological thriller, cozy mystery, Thriller, Paranormal, Occult, Mexico, vigilante"
Literary Collections,"Literary Collections, Folklore"
Short stories,"Short stories, Magical Realism, speculative fiction, Literary Fiction, Contemporary"
